{
  "schema_version": "soc_design_freeze_closure_summary_v1",
  "phase": "SoC-14",
  "node_id": "soc_node_001",
  "request_id": "req_soc_0001",
  "source_checklist_schema": "soc_periodic_reverification_checklist_v1",
  "freeze_declared": true,
  "closure_declared": true,
  "closure_status": "CLOSED_DESIGN_ONLY",
  "freeze_reason": "DESIGN_LINE_CLOSED_REPORTS_ONLY",
  "reports_only": true,
  "record_only": true,
  "execution_allowed": false,
  "production_status": "NO_GO",
  "actual_execution": false,
  "external_send_executed": false,
  "freeze_executed": false,
  "isolation_executed": false,
  "state_change_executed": false,
  "closure_summary": {
    "target_count": 13,
    "coverage_complete": true,
    "next_cycle_entry": "MANUAL_OR_SCHEDULED_REVIEW_ONLY"
  },
  "timestamp_utc": "2026-06-07T00:00:00+00:00"
}
